{
    "run_id": "gf-01-a2a-official-v0.2",
    "entry_script": "./gf-01-a2a-official-v0.2.repro.sh",
    "commands": [
        "pip3 install -q -r requirements.txt",
        "python3 generate_pack.py"
    ],
    "expected_outputs": {
        "pack_dir": "./output/a2a/pack"
    },
    "constraints": {
        "no_absolute_paths": true,
        "deterministic": true
    },
    "source_generator": "tests/cross-substrate/gf-01/a2a/generate_pack.py"
}